{
  "schema_version": "1.0",
  "id": "rx6900xt-qwen38-27b-iq3xxs-64k-q8-mtp-65536",
  "preset": "rx6900xt-qwen38-27b-iq3xxs-64k-q8-mtp",
  "status": "published",
  "provenance": "seed-tested",
  "hardware": {
    "gpu_count": 1,
    "gpu_model": "AMD Radeon RX 6900 XT",
    "architecture_target": "gfx1030",
    "power_profile": "COMPUTE"
  },
  "runtime": {
    "backend": "ROCm/HIP",
    "engine": "llama.cpp",
    "version": "0.1.0-dev build 10450",
    "commit": "ece963f41"
  },
  "context": {
    "highest_useful_tokens": 65536,
    "server_effective_tokens": 65536,
    "server_configured_tokens": 65536,
    "actual_prompt_tokens": {
      "retrieval": 57742,
      "sustained_generation": 45961
    },
    "validated_for": "Uncached 64K retrieval and sustained generation with thinking enabled, q8_0 KV, parallel=1, and built-in draft-MTP n=2 / p-min=0.1."
  },
  "evidence": {
    "checks": {
      "retrieval_repeats": 2,
      "sustained_generation_repeats": 2,
      "prompt_cache_disabled": true,
      "unique_leading_request_nonce": true,
      "thinking_disabled_explicitly": false,
      "visible_final_content_required": true,
      "retrieval_output_tokens": 1024,
      "sustained_output_tokens": 3072,
      "minimum_generated_tokens": 1076
    },
    "metrics": {
      "median_prefill_tok_s": 357.282,
      "median_decode_tok_s": 30.432,
      "retrieval_decode_tok_s": 35.703,
      "median_draft_acceptance_rate": 0.603
    }
  },
  "source_receipts": [
    "data/evidence/receipts/rx6900xt-qwen38-27b-iq3xxs-64k-q8-mtp-20260816-pass.json"
  ],
  "caveats": [
    "Measured only on one AMD Radeon RX 6900 XT (gfx1030) through ROCm/HIP under the COMPUTE power profile; do not generalize to RX 9070 XT or other 16GB Radeon cards.",
    "Thinking remained enabled. Retrieval used up to 1024 output tokens so hidden reasoning could finish before the required visible exact answer.",
    "This validates the exact 64K q8_0-KV, b512/ub128, parallel=1, built-in draft-MTP n=2 / p-min=0.1 preset; changing backend, KV precision, parallelism, speculation, batch shape, or power profile is a different lane.",
    "The evidence establishes context fit, retrieval, and sustained generation. It is not a broad capability or answer-quality benchmark."
  ]
}
